{
  "$schema": "https://json-schema.org/draft/2020-12/schema",
  "title": "AcceptedPrefixBatch",
  "description": "Owned, read-only continuous batch produced only after application validation.\n\nThe consumer must already have the full source and validated input context.\nEvidence can refer to earlier batches or chapters in that context. This is\nnot a `ValidatedChapter`, a durable commit, or permission to seal a speech plan.",
  "type": "object",
  "properties": {
    "base_revision": {
      "type": "integer",
      "format": "uint64",
      "minimum": 1
    },
    "book_id": {
      "$ref": "#/$defs/BookId"
    },
    "chapter_id": {
      "$ref": "#/$defs/ChapterId"
    },
    "characters": {
      "type": "array",
      "items": {
        "$ref": "#/$defs/Character"
      }
    },
    "format_version": {
      "type": "integer",
      "format": "uint32",
      "maximum": 1,
      "minimum": 1
    },
    "run_id": {
      "$ref": "#/$defs/AnalysisRunId"
    },
    "segments": {
      "type": "array",
      "items": {
        "$ref": "#/$defs/Segment"
      },
      "minItems": 1
    },
    "sequence": {
      "type": "integer",
      "format": "uint",
      "minimum": 1
    },
    "source_sha256": {
      "type": "string",
      "pattern": "^[0-9a-f]{64}$"
    }
  },
  "additionalProperties": false,
  "required": [
    "format_version",
    "run_id",
    "sequence",
    "book_id",
    "chapter_id",
    "source_sha256",
    "base_revision",
    "segments",
    "characters"
  ],
  "$defs": {
    "AnalysisRunId": {
      "description": "Digest binding a host execution key to the source, context and analysis options.",
      "type": "string",
      "pattern": "^[0-9a-f]{64}$"
    },
    "Attribution": {
      "description": "Draft attribution payload; states cannot mix resolved and unknown fields.",
      "oneOf": [
        {
          "description": "One identified character.",
          "type": "object",
          "properties": {
            "character_id": {
              "description": "Existing character identity.",
              "$ref": "#/$defs/CharacterId"
            },
            "evidence_segment_ids": {
              "description": "Evidence IDs in the same chapter.",
              "type": "array",
              "items": {
                "$ref": "#/$defs/SegmentId"
              }
            },
            "review_status": {
              "description": "Human confirmation, separate from resolution.",
              "$ref": "#/$defs/ReviewStatus"
            },
            "status": {
              "type": "string",
              "const": "resolved"
            }
          },
          "additionalProperties": false,
          "required": [
            "status",
            "character_id",
            "evidence_segment_ids",
            "review_status"
          ]
        },
        {
          "description": "At least two distinct possible characters.",
          "type": "object",
          "properties": {
            "candidate_ids": {
              "description": "Existing candidate identities.",
              "type": "array",
              "items": {
                "$ref": "#/$defs/CharacterId"
              },
              "minItems": 2
            },
            "evidence_segment_ids": {
              "description": "Evidence IDs in the same chapter.",
              "type": "array",
              "items": {
                "$ref": "#/$defs/SegmentId"
              }
            },
            "review_status": {
              "description": "Human confirmation, separate from resolution.",
              "$ref": "#/$defs/ReviewStatus"
            },
            "status": {
              "type": "string",
              "const": "ambiguous"
            }
          },
          "additionalProperties": false,
          "required": [
            "status",
            "candidate_ids",
            "evidence_segment_ids",
            "review_status"
          ]
        },
        {
          "description": "No identified speaker; this is not automatically narration.",
          "type": "object",
          "properties": {
            "evidence_segment_ids": {
              "description": "Optional supporting evidence IDs in the same chapter.",
              "type": "array",
              "items": {
                "$ref": "#/$defs/SegmentId"
              }
            },
            "review_status": {
              "description": "Human confirmation of the unknown status.",
              "$ref": "#/$defs/ReviewStatus"
            },
            "status": {
              "type": "string",
              "const": "unknown"
            }
          },
          "additionalProperties": false,
          "required": [
            "status",
            "evidence_segment_ids",
            "review_status"
          ]
        }
      ]
    },
    "BookId": {
      "description": "Opaque book identity, separate from a title.",
      "type": "string",
      "minLength": 1,
      "pattern": "\\S"
    },
    "ChapterId": {
      "description": "Opaque chapter identity, separate from ordering.",
      "type": "string",
      "minLength": 1,
      "pattern": "\\S"
    },
    "Character": {
      "description": "An editable draft character record, untrusted until book validation.",
      "type": "object",
      "properties": {
        "aliases": {
          "description": "Other names; the same alias can refer to multiple identities.",
          "type": "array",
          "items": {
            "type": "string"
          }
        },
        "display_name": {
          "description": "Current display name; need not be unique.",
          "type": "string"
        },
        "evidence": {
          "description": "Evidence of this character in supplied chapters.",
          "type": "array",
          "items": {
            "$ref": "#/$defs/EvidenceRef"
          }
        },
        "extensions": {
          "description": "Application-specific additions.",
          "type": "object",
          "additionalProperties": true
        },
        "id": {
          "description": "Stable identity.",
          "$ref": "#/$defs/CharacterId"
        },
        "review_status": {
          "description": "Human confirmation state.",
          "$ref": "#/$defs/ReviewStatus"
        },
        "voice_profile": {
          "description": "Optional semantic description.",
          "anyOf": [
            {
              "$ref": "#/$defs/VoiceProfile"
            },
            {
              "type": "null"
            }
          ]
        }
      },
      "additionalProperties": false,
      "required": [
        "id",
        "display_name",
        "aliases",
        "review_status",
        "evidence"
      ]
    },
    "CharacterId": {
      "description": "Stable character identity, separate from names and voices.",
      "type": "string",
      "minLength": 1,
      "pattern": "\\S"
    },
    "EvidenceRef": {
      "description": "Reference to a segment in an explicitly supplied chapter.",
      "type": "object",
      "properties": {
        "chapter_id": {
          "description": "Chapter containing the evidence.",
          "$ref": "#/$defs/ChapterId"
        },
        "segment_id": {
          "description": "Evidence segment within that chapter.",
          "$ref": "#/$defs/SegmentId"
        }
      },
      "additionalProperties": false,
      "required": [
        "chapter_id",
        "segment_id"
      ]
    },
    "ExpressionKind": {
      "description": "Expression function, independent from character identity.",
      "oneOf": [
        {
          "description": "Narrative text, possibly spoken by a known first-person narrator.",
          "type": "string",
          "const": "narration"
        },
        {
          "description": "Spoken dialogue.",
          "type": "string",
          "const": "speech"
        },
        {
          "description": "Internal thought.",
          "type": "string",
          "const": "thought"
        },
        {
          "description": "Quoted text that need not be character dialogue.",
          "type": "string",
          "const": "quoted_text"
        }
      ]
    },
    "ReviewStatus": {
      "description": "Human review, independent of whether attribution is resolved.",
      "oneOf": [
        {
          "description": "Not yet confirmed by a human.",
          "type": "string",
          "const": "unreviewed"
        },
        {
          "description": "Confirmed by a human; future model workflows must protect corrections.",
          "type": "string",
          "const": "confirmed"
        }
      ]
    },
    "Segment": {
      "description": "An editable source partition segment, not yet a checked byte range.",
      "type": "object",
      "properties": {
        "attribution": {
          "description": "Required for speech and thought; optional for other kinds.",
          "anyOf": [
            {
              "$ref": "#/$defs/Attribution"
            },
            {
              "type": "null"
            }
          ]
        },
        "end": {
          "description": "Exclusive ending byte offset.",
          "type": "integer",
          "format": "uint",
          "minimum": 0
        },
        "extensions": {
          "description": "Application-specific additions.",
          "type": "object",
          "additionalProperties": true
        },
        "id": {
          "description": "Unique chapter-local segment identity.",
          "$ref": "#/$defs/SegmentId"
        },
        "kind": {
          "description": "Expression function.",
          "$ref": "#/$defs/ExpressionKind"
        },
        "start": {
          "description": "Inclusive starting byte offset.",
          "type": "integer",
          "format": "uint",
          "minimum": 0
        }
      },
      "additionalProperties": false,
      "required": [
        "id",
        "start",
        "end",
        "kind"
      ]
    },
    "SegmentId": {
      "description": "Opaque segment identity within one source version.",
      "type": "string",
      "minLength": 1,
      "pattern": "\\S"
    },
    "VoiceProfile": {
      "description": "Optional draft semantic voice description; contains no backend voice IDs.",
      "type": "object",
      "properties": {
        "age_band": {
          "description": "Evidence-grounded age description, absent or `unknown` if unspecified.",
          "type": [
            "string",
            "null"
          ]
        },
        "evidence": {
          "description": "Evidence supporting non-unknown profile claims.",
          "type": "array",
          "default": [],
          "items": {
            "$ref": "#/$defs/EvidenceRef"
          }
        },
        "gender": {
          "description": "Evidence-grounded description, absent or `unknown` if unspecified.",
          "type": [
            "string",
            "null"
          ]
        },
        "impressions": {
          "description": "Free-text semantic impressions, not synthesis parameters.",
          "type": "array",
          "default": [],
          "items": {
            "type": "string"
          }
        }
      },
      "additionalProperties": false
    }
  }
}